Terms,Meanings,Meanings,Meanings,Meanings,Meanings,Meanings,Meanings
Day 55,,,,,,,
account for,"syn: explain, constitute, represent",account for 30% of,oluşturmak [f.],tekabül etmek (sayısal veri) [f.],açıklamak [f.],,
back up,"syn: support, confirm",back up a claim,desteklemek [f.],,,,
be based on / upon,"syn: be founded on, rely on",be based on evidence,-e dayalı olmak [f.],-i temel almak [f.],,,
be made up of,"syn: consist of, be composed of",be made up of cells,-den oluşmak [f.],içermek [f.],kapsamak [f.],,
break down,"syn: collapse, fail, stop working",machines break down,bozulmak [f.],çalışmamak [f.],kırılmak [f.],,
break into,syn: enter by force,break into a system,zorla girmek [f.],,,,
break out,"syn: erupt, start suddenly",a fire breaks out,patlak vermek [f.],"çıkmak (savaş, yangın) [f.]",,,
break through,"syn: penetrate, overcome",break through barriers,delip geçmek [f.],"üstesinden gelmek (engel, bariyer, problem) [f.]",,,
bring about / on,"syn: cause, lead to, result in",bring about climate change,sebep olmak [f.],neden olmak [f.],,,
bring down,"syn: reduce, lower, decrease",bring down costs,düşürmek [f.],azaltmak [f.],aşağı çekmek [f.],,
bring up,"syn: raise, mention",bring up an issue,"gündeme getirmek (konu, mesele) [f.]",büyütmek [f.],,,
bring out,"syn: release, publish, launch",bring out a new product,piyasaya sürmek [f.],,,,
blow up,"syn: explode, inflate",a storm blows up,çıkmak (fırtına) [f.],şişirmek [f.],patlamak [f.],,
call for,"syn: require, demand",call for further research,çağrıda bulunmak [f.],gerektirmek [f.],,,
call off,"syn: cancel, abandon",call off a project,iptal etmek [f.],vazgeçmek [f.],,,
carry on,"syn: continue, maintain",carry on research,devam etmek [f.],sürdürmek [f.],,,
carry out,"syn: perform, conduct, implement",carry out experiments,yürütmek [f.],yerine getirmek [f.],"icra etmek (araştırma, deney) [f.]",,
catch up (with),"syn: reach the same level, overtake",catch up with technology,arayı kapatmak [f.],yakalamak [f.],,,
come about,"syn: happen, occur",changes come about,meydana gelmek [f.],ortaya çıkmak [f.],,,
come across,"syn: encounter, run into",come across evidence,karşılaşmak [f.],rastlaşmak [f.],,,
come up with,"syn: propose, produce, find",come up with a solution,ortaya atmak [f.],sunmak [f.],"bulmak (icat, çözüm, fikir) [f.]",,
count on / upon,"syn: rely on, depend on",count on support,güvenmek [f.],bel bağlamak [f.],,,
cut down on,"syn: reduce, decrease",cut down on emissions,kısmak [f.],azaltmak [f.],,,
depend on / upon,"syn: rely on, be determined by",depend on temperature,-e bağlı olmak [f.],dayanmak [f.],güvenmek [f.],,
die out,"syn: become extinct, disappear",species die out,nesli tükenmek [f.],yok olmak [f.],,,
do away with,"syn: abolish, eliminate",do away with old methods,yürürlükten kaldırmak [f.],ortadan kaldırmak [f.],,,
draw on,"syn: use, utilize, make use of",draw on previous studies,faydalanmak [f.],yararlanmak [f.],kullanmak [f.],,
drop by/in,syn: visit briefly,drop by a laboratory,uğramak [f.],,,,
embark on,"syn: start, begin, undertake",embark on a project,bir işe girişmek [f.],başlamak [f.],,,
end up with,"syn: finish with, result in",end up with a result,nihayetinde ... olmak [f.],kendini bir yerde/durumda bulmak [f.],,,
fall behind,syn: lag behind,fall behind schedule,geride kalmak [f.],arkada kalmak [f.],,,
figure out,"syn: understand, solve",figure out the cause,çözmek [f.],anlamak [f.],,,
find out,"syn: discover, learn",find out why,ortaya çıkarmak [f.],keşfetmek [f.],bulmak [f.],,
get along with,"syn: have good relations, agree",get along with others,iyi geçinmek [f.],anlaşmak [f.],,,
get around,"syn: overcome, solve",get around obstacles,halletmek [f.],üstesinden gelmek [f.],,,
get over,"syn: recover from, overcome",get over a disease,iyileşmek [f.],atlatmak [f.],,,
get rid of,"syn: eliminate, remove",get rid of waste,kurtulmak [f.],,,,
give away,"syn: donate, give for free",give away samples,bağışlamak [f.],ücretsiz vermek [f.],,,
give in,"syn: yield, surrender",give in to pressure,teslim olmak [f.],kabullenmek [f.],boyun eğmek [f.],,
give off / out,"syn: emit, release, send out",give off heat,yaymak [f.],"salmak (elektrik, gaz, enerji) [f.]",,,
give up,"syn: quit, abandon, stop",give up smoking,vazgeçmek [f.],bırakmak [f.],,,
go over,"syn: review, examine",go over results,üzerinden geçmek [f.],detaylıca incelemek [f.],,,
go through,"syn: experience, undergo, examine",go through changes,geçirmek [f.],"yaşamak (tecrübe, olay) [f.]",çekmek (hastalık) [f.],incelemek [f.],
hand down,"syn: pass on, transmit",hand down knowledge,devretmek [f.],aktarmak (kuşaktan kuşağa) [f.],miras bırakmak [f.],,
hand in,"syn: submit, deliver",hand in a report,elden teslim etmek [f.],ibraz etmek [f.],,,
keep on,"syn: continue, persist",keep on increasing,devam etmek [f.],,,,
keep off,"syn: stay away from, avoid",keep off dangerous areas,uzak durmak [f.],yaklaşmamak [f.],,,
keep up with,"syn: follow, stay informed, catch up",keep up with advances,arayı kapatmak [f.],yakalamak [f.],güncel kalmak [f.],haberdar olmak [f.],
lay out,"syn: arrange, design, plan",lay out a plan,bir düzene sokmak [f.],tasarlamak [f.],,,
let down,syn: disappoint,let down expectations,üzmek [f.],hayal kırıklığına uğratmak [f.],,,
look after,"syn: take care of, care for",look after patients,bakmak [f.],ilgilenmek [f.],göz kulak olmak [f.],,
look down on,"syn: despise, humiliate",look down on others,tepeden bakmak [f.],hor görmek [f.],aşağılamak [f.],,
look for,"syn: search for, seek",look for evidence,aramak [f.],,,,
look into,"syn: investigate, examine",look into causes,incelemek [f.],araştırmak [f.],,,
look out,"syn: beware, watch out",look out for symptoms,sakınmak [f.],gözetmek [f.],dikkat etmek [f.],,
look over,"syn: review briefly, inspect",look over data,göz gezdirmek [f.],kısaca incelemek [f.],,,
look up,syn: search in a dictionary,look up a term,sözlükte kelime aramak [f.],,,,
look up to,"syn: admire, respect",look up to scientists,hayranlık duymak [f.],saygı duymak [f.],,,
make do with,"syn: manage with, cope with",make do with limited resources,ile yetinmek [f.],idare etmek [f.],,,
make up,"syn: constitute, form, invent",make up 70% of,oluşturmak [f.],teşkil etmek [f.],"uydurmak (bahane, hikâye) [f.]",,
make up for,"syn: compensate for, offset",make up for losses,telafi etmek [f.],kapatmak (açığı/eksiği) [f.],,,
make up with,syn: reconcile with,make up with someone,arayı düzeltmek [f.],barışmak [f.],,,
make out,"syn: understand, figure out",make out details,anlamak [f.],çözmek [f.],,,
name after,"syn: give the same name, call after",name after a scientist,adını vermek [f.],ismini koymak [f.],,,
pass away,syn: die,pass away from illness,ölmek [f.],can vermek [f.],,,
pass out,"syn: faint, lose consciousness",pass out due to heat,bayılmak [f.],kendinden geçmek [f.],,,
pave the way for,"syn: prepare the ground for, enable",pave the way for research,zemin hazırlamak [f.],yol açmak [f.],,,
pick up,"syn: collect, take, learn",pick up signals,birini almak (arabayla) [f.],toplamak [f.],almak [f.],,
pull through,"syn: recover, survive",pull through illness,iyileşmek [f.],atlatmak [f.],,,
put aside,"syn: save, set aside",put aside funds,kenara koymak [f.],biriktirmek [f.],,,
put forward,"syn: propose, suggest, claim",put forward a theory,ileri sürmek [f.],ortaya atmak [f.],,,
put off,"syn: postpone, delay",put off treatment,ertelemek [f.],geciktirmek [f.],,,
put on,"syn: wear, host",put on weight,giymek [f.],"takmak (kıyafet, aksesuar) [f.]",ağırlamak [f.],misafir etmek [f.],
put out,syn: extinguish,put out a fire,"söndürmek (yangın, ateş) [f.]",,,,
put up with,"syn: tolerate, endure",put up with noise,katlanmak [f.],dayanmak [f.],tahammül etmek [f.],,
rely on / upon,"syn: depend on, count on",rely on evidence,güvenmek [f.],bel bağlamak [f.],-e bağlı olmak [f.],dayanmak [f.],
rest on / upon,"syn: depend on, be based on",rest on assumptions,-e bağlı olmak [f.],dayanmak [f.],,,
root out,"syn: eradicate, eliminate",root out disease,kökünü kurutmak [f.],yok etmek [f.],,,
run into/across,"syn: encounter, come across",run into problems,karşılaşmak [f.],rast gelmek [f.],,,
run on,"syn: operate on, be powered by",run on electricity,çalışmak (bir güç ya da enerji ile) [f.],,,,
run out of,"syn: deplete, use up, exhaust",run out of time,bitmek [f.],"tükenmek (para, zaman, güç) [f.]",,,
send off / out,"syn: emit, release, give off",send out signals,yaymak [f.],"salmak (elektrik, gaz, enerji) [f.]",,,
set on / out / about,"syn: begin, start, embark on",set out to prove,bir işe girişmek [f.],başlamak [f.],,,
set up,"syn: establish, found, start",set up a laboratory,kurmak [f.],başlamak [f.],,,
sort out,"syn: classify, organize, solve",sort out data,sınıflandırmak [f.],gruplandırmak [f.],çözümlemek [f.],,
stand against,"syn: oppose, resist",stand against pollution,"karşısında durmak (fikir, görüş) [f.]",,,,
stand for,"syn: represent, support",stand for a concept,savunmak [f.],desteklemek [f.],simgelemek [f.],,
stand out,"syn: be noticeable, attract attention",stand out clearly,göze çarpmak [f.],dikkat çekmek [f.],,,
step down,"syn: resign, leave office",step down from office,istifa etmek [f.],görevi bırakmak [f.],,,
spring up,"syn: appear suddenly, emerge",spring up rapidly,kısa zamanda meydana çıkmak [f.],türemek [f.],,,
take after,syn: resemble,take after parents,benzemek [f.],soya çekmek [f.],,,
take off,"syn: rise, leave the ground, remove",planes take off,"yükselişe geçmek (uçak, helikopter) [f.]",kıyafetini çıkarmak [f.],,,
take over,"syn: assume, undertake, seize control",take over control,üstüne almak [f.],üstlenmek (görev) [f.],"ele geçirmek (yönetim, kontrol) [f.]",,
take up,"syn: occupy, start, engage in",take up space,kaplamak [f.],"işgal etmek (yer, zaman) [f.]","meşgul olmak (iş, hobi, aktivite) [f.]",,
take to,"syn: go to, move into",take to the streets,"-e dökülmek (sokak, cadde) [f.]",,,,
turn down,"syn: reject, refuse, lower",turn down an offer,geri çevirmek [f.],reddetmek [f.],sesini kısmak [f.],,
turn over,"syn: hand over, deliver, make turnover",turn over control,"teslim etmek (göçmen, kaçak) [f.]",ciro yapmak [f.],,,
throw up,"syn: vomit, build quickly",throw up buildings,kusmak [f.],hızlıca inşa etmek [f.],,,
use up,"syn: consume, deplete",use up resources,tüketmek [f.],bitirmek [f.],,,
wear out,"syn: erode, damage, exhaust",wear out materials,yıpratmak [f.],eskitmek [f.],aşındırmak [f.],,
wipe out,"syn: eliminate, destroy",wipe out populations,yok etmek [f.],silip süpürmek [f.],,,
work out,"syn: solve, understand, develop",work out a solution,anlamak [f.],çözmek [f.],kavramak [f.],gelişmek (olaylar) [f.],
